{
  "catalog": "clean-code-java-rules",
  "version": "1.0.0",
  "schema": "clean-code-rule-v1",
  "language": "java",
  "rule_count": 83,
  "rules": [
    {
      "id": "CC-JV-001",
      "language": "java",
      "category": "classes",
      "severity": "high",
      "title": "Clase con una sola responsabilidad",
      "description": "Cada clase debe tener una unica razon para cambiar y evitar mezclar logica de dominios distintos.",
      "rationale": "Aplicar SRP reduce acoplamiento, facilita pruebas y mejora mantenibilidad.",
      "detection": {
        "type": "semantic",
        "notes": "Detectar clases con metodos publicos de mas de un caso de uso o con dependencias de dominios no cohesionados."
      },
      "bad_example": "Una clase maneja autenticacion, envio de emails y gestion de sesiones al mismo tiempo.",
      "good_example": "Separar en AuthenticationService, UserEmailNotifier y SessionManager.",
      "fix_strategy": [
        "separar responsabilidades por caso de uso",
        "extraer collaborators especificos",
        "reducir API publica a operaciones cohesionadas"
      ],
      "tags": [
        "clean-code",
        "classes",
        "srp",
        "maintainability"
      ],
      "references": [
        "CC-03"
      ]
    },
    {
      "id": "CC-JV-002",
      "language": "java",
      "category": "functions",
      "severity": "high",
      "title": "Funciones deben hacer una sola cosa",
      "description": "Una funcion debe realizar pasos de un unico nivel de abstraccion.",
      "rationale": "Funciones pequenas y enfocadas son mas faciles de probar y reutilizar.",
      "detection": {
        "type": "semantic",
        "notes": "Si puedes extraer otra funcion con nombre significativo, la original hacia mas de una cosa."
      },
      "bad_example": "Una funcion valida, hace setup y renderiza HTML.",
      "good_example": "Dividir en includeSetupPages, renderPage e isTestPage.",
      "fix_strategy": [
        "Extraer metodos por nivel de abstraccion",
        "Eliminar secciones heterogeneas"
      ],
      "tags": [
        "functions",
        "abstraction",
        "refactoring"
      ],
      "references": [
        "G30",
        "F1"
      ]
    },
    {
      "id": "CC-JV-003",
      "language": "java",
      "category": "names",
      "severity": "medium",
      "title": "Nombres que revelan la intencion",
      "description": "El nombre debe indicar por que existe, que hace y como se usa.",
      "rationale": "Evita que el lector tenga que descifrar el codigo.",
      "detection": {
        "type": "pattern",
        "notes": "Buscar nombres de una letra o genericos como data/info fuera de ambitos minimos."
      },
      "bad_example": "int d;",
      "good_example": "int elapsedTimeInDays;",
      "fix_strategy": [
        "Renombrar con lenguaje de dominio",
        "Eliminar comentarios explicativos",
        "Usar nombres pronunciables y buscables"
      ],
      "tags": [
        "naming",
        "readability",
        "intent"
      ],
      "references": [
        "N1",
        "N4"
      ]
    },
    {
      "id": "CC-JV-004",
      "language": "java",
      "category": "general",
      "severity": "high",
      "title": "Eliminar duplicacion (DRY)",
      "description": "La duplicacion indica una abstraccion pendiente.",
      "rationale": "Duplicar logica aumenta errores al propagar cambios.",
      "detection": {
        "type": "pattern",
        "notes": "Buscar bloques identicos, algoritmos muy similares o switches repetidos."
      },
      "bad_example": "Cuatro implementaciones casi identicas de setup/teardown.",
      "good_example": "Metodo generico include(pageName, type).",
      "fix_strategy": [
        "Extraer metodos",
        "Usar Template Method cuando aplique",
        "Sustituir switch repetidos por polimorfismo"
      ],
      "tags": [
        "dry",
        "abstraction",
        "duplication"
      ],
      "references": [
        "G5"
      ]
    },
    {
      "id": "CC-JV-005",
      "language": "java",
      "category": "comments",
      "severity": "medium",
      "title": "Eliminar codigo comentado",
      "description": "El codigo comentado debe eliminarse.",
      "rationale": "Se pudre, distrae y genera deuda tecnica.",
      "detection": {
        "type": "pattern",
        "notes": "Detectar bloques de codigo dentro de comentarios."
      },
      "bad_example": "// old code",
      "good_example": "Borrar codigo y confiar en git para historico.",
      "fix_strategy": [
        "Borrar codigo comentado",
        "Confiar en control de versiones"
      ],
      "tags": [
        "comments",
        "cleanliness",
        "clutter"
      ],
      "references": [
        "C5"
      ]
    },
    {
      "id": "CC-JV-006",
      "language": "java",
      "category": "functions",
      "severity": "medium",
      "title": "Evitar argumentos de bandera (flags)",
      "description": "Un booleano en firma suele indicar dos comportamientos.",
      "rationale": "Complica lectura y mantenimiento de llamadas.",
      "detection": {
        "type": "pattern",
        "notes": "Funciones con booleanos o enums usados para alternar comportamiento."
      },
      "bad_example": "render(true)",
      "good_example": "renderForSuite() y renderForSingleTest().",
      "fix_strategy": [
        "Dividir en funciones especializadas",
        "Aplicar polimorfismo para variaciones"
      ],
      "tags": [
        "functions",
        "refactoring",
        "clarity"
      ],
      "references": [
        "F3",
        "G15"
      ]
    },
    {
      "id": "CC-JV-007",
      "language": "java",
      "category": "classes",
      "severity": "high",
      "title": "Ley de Demeter (Evitar naufragios de tren)",
      "description": "Un metodo debe hablar con colaboradores directos, no con extra\u00f1os encadenados.",
      "rationale": "Reduce acoplamiento y fragilidad ante cambios internos.",
      "detection": {
        "type": "pattern",
        "notes": "Buscar cadenas como a.getB().getC().doSomething()."
      },
      "bad_example": "ctxt.getOptions().getScratchDir().getAbsolutePath();",
      "good_example": "ctxt.createScratchFileStream(filename);",
      "fix_strategy": [
        "Tell, Don't Ask",
        "Encapsular navegacion interna"
      ],
      "tags": [
        "coupling",
        "classes",
        "demeter"
      ],
      "references": [
        "G36"
      ]
    },
    {
      "id": "CC-JV-008",
      "language": "java",
      "category": "names",
      "severity": "medium",
      "title": "Evitar codificaciones (Notacion Hungara)",
      "description": "No incluir tipo o ambito en el nombre.",
      "rationale": "Aumenta carga cognitiva y dificulta cambios de tipo.",
      "detection": {
        "type": "pattern",
        "notes": "Buscar prefijos m_, f_, str, i."
      },
      "bad_example": "private String m_dsc;",
      "good_example": "String description;",
      "fix_strategy": [
        "Renombrar eliminando prefijos tecnicos",
        "Confiar en IDE para tipo y ambito"
      ],
      "tags": [
        "naming",
        "clutter",
        "java"
      ],
      "references": [
        "N6"
      ]
    },
    {
      "id": "CC-JV-009",
      "language": "java",
      "category": "functions",
      "severity": "low",
      "title": "Funciones pequenas",
      "description": "Las funciones deben ser pequenas y con poca anidacion.",
      "rationale": "Mejora legibilidad y regla de paso descendente.",
      "detection": {
        "type": "pattern",
        "notes": "Contar lineas por funcion y profundidad de indentacion."
      },
      "bad_example": "Funcion de 100 lineas con bucles anidados.",
      "good_example": "Jerarquia de funciones pequenas y claras.",
      "fix_strategy": [
        "Extraer bloques if/else/while",
        "Reducir anidamiento"
      ],
      "tags": [
        "functions",
        "size",
        "refactoring"
      ],
      "references": [
        "G30",
        "G34"
      ]
    },
    {
      "id": "CC-JV-010",
      "language": "java",
      "category": "tests",
      "severity": "high",
      "title": "Las Tres Leyes de TDD",
      "description": "No escribir produccion sin test fallando y avanzar rojo-verde-refactor.",
      "rationale": "Hace el codigo verificable y reduce miedo al cambio.",
      "detection": {
        "type": "semantic",
        "notes": "Detectar codigo de produccion sin pruebas asociadas."
      },
      "bad_example": "Implementar feature completa y testear al final.",
      "good_example": "Ciclo corto de test fallando y correccion minima.",
      "fix_strategy": [
        "Aplicar Rojo-Verde-Refactor",
        "Integrar pruebas junto al codigo"
      ],
      "tags": [
        "tdd",
        "unit-tests",
        "professionalism"
      ],
      "references": [
        "T1",
        "T9"
      ]
    },
    {
      "id": "CC-JV-011",
      "language": "java",
      "category": "general",
      "severity": "medium",
      "title": "Reemplazar numeros magicos con constantes con nombre",
      "description": "Evitar literales numericos sin contexto en logica.",
      "rationale": "Reduce ambiguedad y errores.",
      "detection": {
        "type": "pattern",
        "notes": "Buscar literales numericos fuera de casos triviales."
      },
      "bad_example": "double pay = hours * 8.0;",
      "good_example": "double pay = hours * WORK_HOURS_PER_DAY;",
      "fix_strategy": [
        "Crear constantes static final o enums",
        "Nombrar segun significado"
      ],
      "tags": [
        "magic-numbers",
        "naming",
        "general"
      ],
      "references": [
        "G25"
      ]
    },
    {
      "id": "CC-JV-012",
      "language": "java",
      "category": "functions",
      "severity": "medium",
      "title": "Numero ideal de argumentos",
      "description": "Priorizar funciones con pocos argumentos.",